{"$id":"gluerift.host-toolchain-lock.v0.3.1a.schema.json","$schema":"https://json-schema.org/draft/2020-12/schema","additionalProperties":false,"properties":{"descriptor":{"minProperties":1,"type":"object"},"descriptor_runtime":{"pattern":"^/","type":"string"},"descriptor_runtime_version":{"minLength":1,"type":"string"},"descriptor_sha256":{"$ref":"gluerift.common.v0.3.1a.schema.json#/$defs/Sha256"},"host_toolchain_descriptor_sha256":{"$ref":"gluerift.common.v0.3.1a.schema.json#/$defs/Sha256"},"schema":{"const":"gluerift.host-toolchain-lock/v0.3.1a"}},"required":["schema","host_toolchain_descriptor_sha256","descriptor","descriptor_sha256","descriptor_runtime","descriptor_runtime_version"],"type":"object"}