{"descriptor":{"canonical_tool_paths":{"/opt/gluerift/os/usr/bin/cc":"179301dcb41ea78accc3fa0048a7e6f6710d891945a751a34addd622020c1818","/opt/gluerift/os/usr/bin/ld":"28d85b9af18c923db12e0b4ce70b80ee217f2b7cade0e872baa9e8ddc396c08d","/opt/gluerift/toolchains/go/bin/go":"e22f7267b6aa79b1d460e509eff04806401b84e11c2cd772d967c93fc7bb556f","/opt/gluerift/toolchains/rust/bin/cargo":"c512bff73c86143b557463f021d0c3d5b0490d97d65040ba59ea2b3427784758","/opt/gluerift/toolchains/rust/bin/rustc":"b829b733131d4e1673eeebd1f34d06ae1e9ff4977b051313cf42e2a9e79ecf1c"},"cc_sha256":"179301dcb41ea78accc3fa0048a7e6f6710d891945a751a34addd622020c1818","go_sha256":"e22f7267b6aa79b1d460e509eff04806401b84e11c2cd772d967c93fc7bb556f","kernel":"25.5.0","linker_sha256":"28d85b9af18c923db12e0b4ce70b80ee217f2b7cade0e872baa9e8ddc396c08d","machine":"arm64","platform":"macOS-26.5.1-arm64-arm-64bit","rustc_sha256":"b829b733131d4e1673eeebd1f34d06ae1e9ff4977b051313cf42e2a9e79ecf1c","system":"Darwin"},"descriptor_runtime":"/opt/gluerift/os/usr/bin/python3","descriptor_runtime_version":"Python 3.9.6","descriptor_sha256":"b2358d00cbe297de80cf1c019f6860a685a46a48d9970a3f0f812b1d3e83fab3","host_toolchain_descriptor_sha256":"b2358d00cbe297de80cf1c019f6860a685a46a48d9970a3f0f812b1d3e83fab3","schema":"gluerift.host-toolchain-lock/v0.3.1a"}